{"claim_boundary":"Inference qualification of PlanMargin's bounded research trajectory model; not a production autonomy or safety benchmark.","engines":{"fp16":{"batches":{"1":{"device_latency_ms":{"mean":0.213205,"p50":0.202048,"p95":0.26624,"p99":0.370461},"end_to_end_latency_ms":{"mean":0.400687,"p50":0.3925,"p95":0.47113,"p99":0.867003},"latency_ms":{"mean":0.213205,"p50":0.202048,"p95":0.26624,"p99":0.370461},"throughput_samples_per_second":2495.714},"256":{"device_latency_ms":{"mean":0.262008,"p50":0.264416,"p95":0.324555,"p99":0.349983},"end_to_end_latency_ms":{"mean":0.262693,"p50":0.265155,"p95":0.354891,"p99":0.411236},"latency_ms":{"mean":0.262008,"p50":0.264416,"p95":0.324555,"p99":0.349983},"throughput_samples_per_second":974521.59},"8":{"device_latency_ms":{"mean":0.246823,"p50":0.239072,"p95":0.319781,"p99":0.413715},"end_to_end_latency_ms":{"mean":0.221709,"p50":0.218299,"p95":0.243152,"p99":0.28682},"latency_ms":{"mean":0.246823,"p50":0.239072,"p95":0.319781,"p99":0.413715},"throughput_samples_per_second":36083.334}},"bytes":820460,"pytorch_fp32_parity":{"1":{"max_absolute_error_m":0.01200008,"rmse_m":0.00290232},"256":{"max_absolute_error_m":0.10103607,"rmse_m":0.00650152},"8":{"max_absolute_error_m":0.02392197,"rmse_m":0.00469784}},"sha256":"613a042497edef69bd028d5d3594e4d9862f86d7b00cff141bbc4d5946633bcb","source_onnx_sha256":"8d090df7b3b241c98684bf0ec046ac77e9cf2015089fab3dcea0f4761d8499a4"},"fp32":{"batches":{"1":{"device_latency_ms":{"mean":0.267763,"p50":0.244368,"p95":0.337008,"p99":0.37528},"end_to_end_latency_ms":{"mean":0.3035,"p50":0.276828,"p95":0.356027,"p99":0.44167},"latency_ms":{"mean":0.267763,"p50":0.244368,"p95":0.337008,"p99":0.37528},"throughput_samples_per_second":3294.893},"256":{"device_latency_ms":{"mean":0.27907,"p50":0.2744,"p95":0.307018,"p99":0.330003},"end_to_end_latency_ms":{"mean":0.362507,"p50":0.359202,"p95":0.40227,"p99":0.434733},"latency_ms":{"mean":0.27907,"p50":0.2744,"p95":0.307018,"p99":0.330003},"throughput_samples_per_second":706193.26},"8":{"device_latency_ms":{"mean":0.205028,"p50":0.185808,"p95":0.275781,"p99":0.309269},"end_to_end_latency_ms":{"mean":0.23974,"p50":0.226223,"p95":0.315462,"p99":0.417369},"latency_ms":{"mean":0.205028,"p50":0.185808,"p95":0.275781,"p99":0.309269},"throughput_samples_per_second":33369.484}},"bytes":1444068,"pytorch_fp32_parity":{"1":{"max_absolute_error_m":4.77e-06,"rmse_m":1.15e-06},"256":{"max_absolute_error_m":4.578e-05,"rmse_m":4.57e-06},"8":{"max_absolute_error_m":3.052e-05,"rmse_m":4.45e-06}},"sha256":"48b2c40508218c754027c0f863cc99fdb91c892899c5ac9f67f9921efc86edb7","source_onnx_sha256":"38934ad17b8ea04698feccf116c6c75a030788124b096c25d99a942386aa73d7"}},"environment":{"cuda":"13.0","platform":"Linux-6.6.122+-x86_64-with-glibc2.35","python":"3.11.16","tensorrt":"11.2.1.2","torch":"2.13.0+cu130"},"gates":{"fp16_max_error_under_7_5e_2_m":false,"fp16_rmse_under_1e_2_m":true,"fp32_max_error_under_1e_4_m":true,"gpu_end_to_end_faster_than_cpu_at_batch_1":true},"gpu":{"compute_capability":[7,5],"name":"Tesla T4","observed_free_memory_delta_bytes":65011712,"total_memory_bytes":15637086208},"measurement":{"batches":[1,8,256],"clocks":{"device":"CUDA events around TensorRT enqueueV3","end_to_end":"host monotonic clock around pinned-host H2D, enqueueV3, D2H, and synchronization"},"cpu_reference_batch_1":{"mean":0.501843,"p50":0.489554,"p95":0.602786,"p99":0.689004},"input_protocol":"deterministic_physical_probe_v1","input_purpose":"deployment timing and numerical parity only","measured_iterations":500,"warmup_iterations":50},"record_type":"planmargin.tensorrt_qualification_report","redistribution":"aggregate_only","report_sha256":"3616ab80c88919efb4fe62a2887d53b4043cc950b8dda28983dccdef716be9b2","schema_version":"2.0.0","source_model_training_data":{"dataset":"Waymo Open Motion Dataset v1.3.1 training TFExamples","synthetic":false},"source_onnx_sha256":"38934ad17b8ea04698feccf116c6c75a030788124b096c25d99a942386aa73d7","source_training_report_sha256":"29221c77688cd4dc8078b1f18f68bcd0694e13fe00f8d2f07d9328d8131e0f04","status":"no_go"}
